{"$schema":"https://json-schema.org/draft/2020-12/schema","$id":"https://github.com/matrakalaka/codex-project-bootstrap/contracts/bootstrap_assessment.v0.schema.json","title":"Bootstrap Assessment v0","type":"object","additionalProperties":false,"required":["schema_version","assessment_id","correlation_id","task_id","source_revision","target","authority","tool_health","known_good_references","recommended_scope","safe_to_bootstrap","human_readable_assessment","assessment_hash","created_at"],"properties":{"schema_version":{"const":"bootstrap_assessment.v0"},"assessment_id":{"type":"string","minLength":1},"correlation_id":{"type":"string","minLength":1},"task_id":{"type":"string","minLength":1},"source_revision":{"type":"string","minLength":1},"target":{"type":"object","additionalProperties":false,"required":["repository_locator","observed_identity","observed_head","observed_branch","worktree_state"],"properties":{"repository_locator":{"type":"string","minLength":1},"observed_identity":{"type":["string","null"]},"observed_head":{"type":["string","null"]},"observed_branch":{"type":["string","null"]},"worktree_state":{"type":"string","enum":["CLEAN","DIRTY","UNKNOWN"]}}},"authority":{"type":"object","additionalProperties":false,"required":["sources","authority_fingerprint","conflicts","resolution_status"],"properties":{"sources":{"type":"array","items":{"type":"object"}},"authority_fingerprint":{"type":["string","null"]},"conflicts":{"type":"array","items":{"type":"object"}},"resolution_status":{"type":"string","enum":["COMPLETE","PARTIAL","BLOCKED"]}}},"tool_health":{"type":"array","items":{"type":"object"}},"known_good_references":{"type":"array","items":{"type":"string"}},"recommended_scope":{"type":"object","additionalProperties":false,"required":["allowed_paths","forbidden_paths"],"properties":{"allowed_paths":{"type":"array","items":{"type":"string"}},"forbidden_paths":{"type":"array","items":{"type":"string"}}}},"safe_to_bootstrap":{"type":"boolean"},"human_readable_assessment":{"type":"string","minLength":1},"assessment_hash":{"type":"string","pattern":"^sha256:[0-9a-f]{64}$"},"created_at":{"type":"string","minLength":1}}}
